,Unnamed: 0,title,date,url,text
0,0,"Tech cruise ships could implement to combat spread of coronavirus: far-UVC sanitation, contact tracingMorgan Hines ","Jun. 3, 2020",https://www.usatoday.com/story/travel/cruises/2020/06/01/coronavirus-cruise-ships-far-uvc-contact-tracing-could-future/5199946002/,"Today, the world faces an unmatched challenge: the coronavirus pandemic, which has infected nearly 6 million people, according to Johns Hopkins data. And cruise ships have been at the center of the drama as passengers have been quarantined and crew members trapped on board. Now, cruise lines need to find new ways to make sure passengers feel safe when boardings resume after the CDC's no-sail order expires in July. Multiple companies are moving ahead with technology that could be implemented on ships so that cruisers can return to sea with less worry – though most cruise lines haven't announced specific plans. Infrared Cameras Inc. announced in a press release, however, that the company is partnering with Carnival Cruise Line to screen passenger and crew member temperatures via thermal camera systems. USA TODAY has reached out to Carnival for more information. 'Hygiene is the new luxury':How cruise ship design could evolve to ward against outbreaks Cleaning a floating petri dish:How is a cruise ship sanitized after a coronavirus outbreak? One technology that could be implemented to disinfect heavy-traffic areas on cruise ships is far-UVC light. Far-UVC light has the capability to scramble the genetic material of viruses such as coronavirus, effectively sanitizing the air, surfaces or even people. ""Ultraviolet light in general has been used to kill bacteria and viruses for a very long time,"" David Brenner, director at the Columbia University Center for Radiological Research, told USA TODAY. It's been known to kill bacteria and viruses for the last century and for the last two to three decades has been used to disinfect surgical theaters or hospital wards. ""It's being used in the MTA here in New York, in the wee hours between 1 a.m. and 5  a.m. when the MTA is closed down,"" he added, referencing the Metropolitan Transportation Authority public transit vehicles and some fixed locations being sanitized with UV light. ""It’s been in use to kill viruses and sterilize locations when people aren’t around, which is not ideal because even if you have a sterilized location at 9 o’clock in the morning and people start coming in, they’re potentially gong to contaminate."" Far-UVC light, which Brenner's team has been working with for the past seven to eight years, can be used to sterilize space while people are around, making it ideal for use in crowded public spaces, including cruise ships. UVC light is similar to coffee at varying temperatures, Fred Maxik, the founder and CTO of Healthe, a company creating sanitation structures with far-UVC light, told USA TODAY. When its wavelength is too long, it's like hot coffee and can burn you. But at the right length (approximately 222 nanometers), far-UVC can't damage living human cells – it disinfects without harming people, Maxik explained. ""Essentially what we found is the wavelength from the UV light, which while still being able to kill bacteria and viruses, it’s not a safety hazard for human exposure,"" Brenner said. ""If we can reduce the level of virus in occupied spaces, we are undoubtedly going to reduce risk of person-to-person transmission."" Separately, Healthe is trying to implement far-UVC light to sanitize people and spaces on cruise ships. ""There are a number of areas you can imagine right away,"" Maxik said. ""Embarkation areas, high-traffic areas around concierge desks, greeting counters, larger gathering spaces, places people get together in small groups like elevators or vestibules – those would be the obvious first places."" He said it would feel a little like Transportation Security Administration checks at the airport: People would go through a portal-like entryway that would emit far-UVC rays that can sanitize boarding crew members and passengers. A passenger would walk in, raise their arms, do a slow, full turn, and then walk through.  The idea is that the portal will ""clean the pathogens off your clothing, off your skin, off any packaging you might carry with you as you walk into the space,"" he said. ""And it does so by essentially disrupting the genetic material of those pathogens."" Packages could also be sanitized in this way, Maxik said. And in some areas, such as bathrooms, typical lights could be replaced with far-UVC lights to continuously sanitize the area. Maxik said the company is in talks with a few major cruise companies about implementing far-UVC light, though he was unable to share which cruise lines at the time of the interview.  Destroying viral genetic material isn't the only way to stop the spread of illnesses like coronavirus on a ship.  Indoor data intelligence can provide cruise lines with insight on where people are congregating, where people might need to be dispersed and who came in contact with whom in case of a viral outbreak on board – all from a signal that each mobile device emits. The cruise ships could monitor their passengers anonymously through their signals, giving the lines an idea of when to ask people to move along. Nadir Ali, the CEO of Inpixon, an indoor data intelligence company, who has worked with cruise lines and hotels, is aiming to incorporate the technology to help safely monitor passengers and lessen fears around cruising. Inpixon specifically can collect and use data acquired using radio frequency scanners that pick up on Wi-Fi, Bluetooth signals and cellular signals.  Cruise operators could view a ship's map, which would be coded in green, yellow and red based on crowd-density levels. ""If a certain deck is turning yellow to red, maybe [someone] needs to go make sure [it isn't too crowded],"" Ali said.  But it could be used for more than crowd control. ""If, God forbid, a patient starts developing symptoms or has come down with COVID-19 or some other virus or flu or something, [the cruise line] could also [ask if] that person can identify themselves,"" he explained. The software used for indoor data intelligence captures a unique code emitted by a phone as part of its signal, Ali explained, but it is encrypted and kept anonymous. However, in a health emergency, those codes could be used. Public health mobile apps:Apple and Google release coronavirus contact tracing technology If the infected person chose to share their information, the cruise line could then determine where that individual had been on board, indicating which areas may need a deeper cleaning in case of contaminated surfaces or whether an area should be closed off. It would also allow the cruise line to identify what other phones and people were in similar proximity – and may have been exposed. While digital contact tracing could be very effective, it also breaches the issue of privacy, which Ali addressed, noting the company never attaches a person's identification to their address unless they choose to have that happen. ""We want to make sure people are consenting and opting in to this process to make sure we protect their privacy,"" he said. Since the idea of contact tracing with coronavirus emerged though, it has come with skepticism from the public. ""There are conflicting interests,"" said Tina White, a Stanford University researcher who first introduced a privacy-protecting approach in February. ""Governments and public health (agencies) want to be able to track people"" to minimize the spread of COVID-19, but people are less likely to download a voluntary app if it is intrusive, she said. And Apple and Google are releasing coronavirus contact tracing applications that can alert people anonymously if they have been in the vicinity of an infected person. While the technology keeps the system anonymous, nearly 3 in 5 Americans still said they would be unwilling or unable to use Google and Apple's contact tracing technology, according to a Washington Post-University of Maryland poll. Is international travel allowed yet? See when Spain, Mexico, Italy, UK plan to reopen borders Contributing: Jessica Guynn, USA TODAY; Associated Press"
1,1,Fact check: Bill Gates did not craft contact tracing billMatthew Brown ,"May 27, 2020",https://www.usatoday.com/story/news/factcheck/2020/05/26/fact-check-bill-gates-did-not-help-craft-hr-6666-contact-tracing-bill/5220823002/,"As communities around the country begin to ease social distancing measures, debates about how to ensure public health have intensified. Discussion has especially targeted recently introduced House legislation, H.R. 6666: COVID-19 Testing, Reaching, And Contacting Everyone Act, which would fund $100 billion for the work of various medical groups which perform COVID-19 testing. Claims that the bill has been influenced by outside corporations or business elites feature prominently. ""This is what Bill Gates and George Soros want to do...Secretly stick you with a chip while testing you for the coronavirus...the Dems have a bill on the house floor ready to vote on it to require this....House Bill 6666...."" a graphic on Facebook shared nearly 200 times reads. Various other claims suggest the TRACE Act permits mass surveillance of individuals, as well as mandated quarantines and vaccinations. The TRACE Act does not allow for any of these things, and Bill Gates was not involved in the crafting of the bill. Sponsored by Rep. Bobby Rush, D-Ill., the TRACE Act would provide $100 billion to faith-based groups, medical centers and other organizations that offer COVID-19 testing. The funding would be intended to help expand coronavirus testing as well as the purchase of personal protective equipment for medical professionals. Contact tracing is the public health practice of documenting where an infected person may have been and with whom he interacted so health officials can accurately estimate the spread of virus. The process may involve the collection of documents, interviewing exposed individuals as well as the use of technology to monitor people's movements. The TRACE Act does not specify a preference for any form of contact tracing and does not designate a role for the federal government in collecting data on people or using it for any means. The bill does give funding priority to groups that operate in low-income and minority communities. “The bill does not force you or your loved ones to do anything at all,” a press release from Rush’s office reads. “With that being said, if you or a loved one does have the coronavirus, it is advised that you do self-quarantine and maintain social distance from others.” Jeremy Edwards, a spokesman for Rush, confirmed that no private firms or outside groups were consulted while crafting the legislation. He also said Rush was indirectly advised on the subject after participating “in a number of briefings and calls with various agencies, including the CDC, on the importance of contact tracing.” Neither Microsoft nor the Bill & Melinda Gates Foundation have advocated for the TRACE Act. The Gates Foundation denied involvement in the crafting of the TRACE Act in a statement to USA TODAY. ""In our home state of Washington, our staff have provided advisory support to public health officials on their COVID-19 response efforts. This has included participating in discussions about epidemiological approaches, such as testing, isolation, contact tracing and quarantine. The Gates Foundation has not provided grant funding to expand contact tracing in the U.S.,"" the statement reads. In early March, the Gates Foundation began funding expanded home testing for COVID-19 in the Seattle area but the program was halted by the Food and Drug Administration in May, pending further oversight. Since the coronavirus pandemic began sweeping the globe, Gates has spoken positively about various efforts to curtail the virus, including contact tracing. Gates devoted a section of his April 23 essay on the pandemic to contact tracing efforts, writing it is “unlikely” that Western countries will adopt the more stringent contact tracing efforts as have been seen in countries like China, Singapore and South Korea. “I think most countries will use the approach that Germany is using, which requires interviewing everyone who tests positive and using a database to make sure there is follow-up with all the contacts,” Gates continued. The Germans separately implemented several of the practices proposed in the TRACE Act. Germany at first proposed a centralized model of data collection for its digital contact tracing efforts but has since opted for a decentralized strategy, similar to those developed by American technology companies to be deployed by local authorities. Gates argued in that same essay, as well as during an April 27 Vox interview, that contact tracing efforts were necessary for reopening efforts to succeed. “Right now, in the U.S., we have not filled the testing and contact tracing structure or innovations, much less these secondary therapeutic or vaccine innovations,” he told Vox. Gates also spoke favorably about efforts by tech companies to develop digital means of contact tracing, like a Bluetooth mechanism jointly established by Apple and Google. The Bill & Melinda Gates Foundation has supported efforts to increase research into testing for COVID-19 since early February but has not directly funded any contact tracing initiatives. While Bill Gates is a staunch proponent of expanding testing for COVID-19, as well as stronger contact tracing efforts, he wasn’t involved in developing the TRACE Act. We rate this claim FALSE because it is not supported by our research. Thank you for supporting our journalism. You can subscribe to our print edition, ad-free app or electronic newspaper replica here. Our fact check work is supported in part by a grant from Facebook."
2,2,I'm a coronavirus contact tracer. Asking vulnerable people to stay home isn't always easy.Shawna Sherman ,"Jun. 3, 2020",https://www.usatoday.com/story/opinion/voices/2020/06/03/coronavirus-contact-tracer-covid-19-california-column/5309779002/,"Just three months ago, I worked as a librarian at the San Francisco Public Library's Main Branch, where I answered questions on a reference desk. Now, I spend my days calling strangers to ask: Have you had any novel coronavirus symptoms in the last three days? Are you able to stay at home? Can we monitor your symptoms? And, by the way, have you been tested?   SARS-CoV-2, the virus that causes COVID-19, is so easily spread that if you are in close contact with someone who has it, it's my job as a contact tracer to help make sure you stay home. As part of the contact tracing team for the City of San Francisco, I do this work from home on my computer. Some days my list of calls to make are few, some days the list approaches a dozen. Often a contact's first language is Spanish because, here in San Francisco, the pandemic has affected the Hispanic and Latino/a populations hardest: they make up 15% of the population, but 47% of cases. Pandemic historian:Don't rush reopening. In 1918, some states ran straight into more death. Under the current health order in San Francisco, those who have been exposed to the virus should quarantine for 14 days after their last contact with a positive case, and isolate, if they become symptomatic or test positive themselves. The city's tracing team is a partnership between University of California San Francisco (UCSF), the San Francisco Department of Public Health, and Dimagi a software company. We are a group of  more than 150 — including contact investigators who gather the names of contacts from positive cases — working to help slow the spread of COVID-19.   I am proud to be part of a team helping our community by connecting people with information that can save lives. Most of us are not health professionals; many, like me, are city workers reassigned during the emergency pandemic. There is a clinician on each team and we're working four hour shifts most days from 8 a.m. to 8 p.m. It's not the easiest job. Some contacts simply don't want to talk; some are audibly sick; some are distraught over hospitalized family members; and some are reluctant to share personal information, possibly distrustful of a government that has discriminated against their community or worried about their immigration status. I wonder: Am I being culturally sensitive; am I gathering all the right information; can I convince the person I'm talking to to stay home? There is a gravity to this request. Staying home is difficult for people who have to leave their house to work, for those who don't have a home or are in a congregate living situation where it would be virtually impossible to isolate. In the workflow developed by UCSF, we have a guide and procedure to connect contacts to resources for help with food, cleaning supplies, testing or housing, and I hope they are able to take advantage of them. An opportunity for reform:COVID-19 highlights racial disparities in our health care system Studies have shown that even people who don't have symptoms can be carriers of the virus and they could be contagious while asymptomatic. In light of this research, as shelter-in-place is lifted and we slowly begin remaking our social lives, it will be more important for contact tracers across the country to act fast to trace positive cases and their contacts to stop the virus from spreading through our community like wildfire. I am grateful and relieved when people say they are staying home, that they want to keep the community healthy. I listen when people want to share how anxious this disease has made them, how hard it is not knowing whether a stuffy nose and fever is the disease. Sometimes I say, yeah, I'm anxious too. It's scary being this close to the pandemic. One day, I talked to a man who was at home in a residential hotel in the city's tenderloin neighborhood, an area notorious for homelessness and drug abuse. The virus has hit this area of the city the hardest. He told me he was going to do all he could to quarantine even though it was difficult in his environment.  Then I mentioned I used to work in his neighborhood at the Main Library and he said he used to go there every day for the computers. Had we talked once in person? I bet we have, I said. And we both imagined a day when we would be back in the library. Our conversation is confidential, I told him, but if you're comfortable, come to the third floor and say hi when this is all over. And hopefully it will be if we all do our part.  Shawna Sherman works as a coronavirus contact tracer in San Francisco."
3,3,Fact Check: Contact tracing won't result in people forcibly removed from their homesAdrienne Dunn ,"May 28, 2020",https://www.usatoday.com/story/news/factcheck/2020/05/28/fact-check-trace-act-hr-6666-wont-forcibly-remove-people-their-homes/5199873002/,"As states begin to reopen and Americans return to work, local governments and health officials are tasked with monitoring the spread of the coronavirus to proactively address any potential outbreaks.  One method for tracking the spread is contact tracing, a process of identification of individuals who may have come into contact with an infected person. On May 1, U.S. Rep. Bobby Rush, D-Illinois, introduced a contact tracing proposal that would help local agencies identify people who were exposed to the coronavirus. H.R. 6666 — the COVID-19 Testing, Reaching, And Contacting Everyone Act would allow local clinics, hospitals, schools and nonprofits to apply for funding under a new grant program.  Soon after the legislation was introduced, people took to social media to discuss their interpretation and critics of the proposal.  A viral Facebook post from Shilamida Kupershteyn claimed contact tracing would allow the government to enter homes at any time and remove family members who had been exposed to the coronavirus. The post ultimately claimed ""contact tracing takes away all of your freedom."" USA TODAY has reached out to Kupershteyn for a comment, but hasn't received a response. Other similar claims about forced removal related to the TRACE Act have been made across Facebook.  According to the legislation and a statement from Rush's office, the bill would set aside $100 billion for ""community health centers, school based health centers, academic medical centers, non-profits, and other entities who would hire and train individuals to operate mobile testing units, as well as outreach in hot spots and medically underserved areas."" Recipients of funds would then have to use the money to buy testing equipment and personal protective gear and hire, train and pay members of the community to operate mobile testing units as well as door-to-door outreach. The legislation does not provide specifics on how grant recipients should conduct contact tracing procedures.  According to the statement, the objective of the bill — and contact tracing as a whole — is to figure out how COVID-19 is spreading through individual communities. The Centers for Disease Control and Prevention states contact tracing is a ""key strategy"" for reducing further spread of COVID-19. During contact tracing, health staff works with patients to help identify everyone they may have come in contact with while they were potentially infectious. Public health staff then warns these individuals about their potential exposure, without revealing the identity of the original patient. They provide information and support to help the contacts understand the risk, monitor themselves and separate from others if necessary. The contacts are encouraged to stay home and social distance for 14 days, in order to prevent potentially furthering the spread of the virus. If contacts do become ill, they can notify the health staff so they can be tested and determine if medical care is necessary.  The CDC says, ""Immediate action is needed. Communities must scale up and train a large contact tracer workforce and work collaboratively across public and private agencies to stop the transmission of COVID-19."" Estimates for the number of contact tracers needed range from 100,000 to 300,000. Tens of thousands of Americans have applied for contact tracer roles, and over 11,000 contact tracers are working in the U.S. as of late April, according to NPR. Critics of the bill, including the author of the viral Facebook post mentioned above, appear to believe that the legislation would allow testing workers to forcibly enter homes and potentially take members of the household to ""safe houses.""  However, the bill states ""nothing in this section shall be construed to supersede any Federal privacy or confidentiality requirement.""  Meaning, the legislation will uphold the rights laid out in privacy protections, the Fourth Amendment right to privacy and the Due Process Clause of the Fourteenth Amendment. ""This bill does not authorize anyone to enter your home, for whatever reason, without your permission, nor does it allow the government to remove anyone from your home because of the coronavirus,"" Rush said in a statement on his website.  The claims in the post have been rated false. The bill's language explicitly states that the legislation would not supersede any existing privacy protections. All testing done by contact tracing groups would be voluntary, testing groups could not enter homes against the owner's wishes and members of the household would not be forcibly taken.  Thank you for supporting our journalism. You can subscribe to our print edition, ad-free app or electronic newspaper replica here. Our fact check work is supported in part by a grant from Facebook."
