,Unnamed: 0,title,date,url,text
32,32,"Opinion: We might be seeing a wild, wild west of college football and coronavirus testing","Jun. 12, 2020",https://www.usatoday.com/story/sports/columnist/dan-wolken/2020/06/12/college-football-faces-many-coronavirus-questions/5344995002/,"As college football players have returned to campus for voluntary workouts this month, we’ve seen a parade of announcements from athletic departments about how many athletes have tested positive for COVID-19 during re-entry. While some people would interpret the data as concerning when positive tests do pop up, the reality is that schools are making these announcements public because it shows that their screening procedures are working. ""It gives us a great baseline moving forward,"" said one athletics director who spoke to USA TODAY Sports on the condition of anonymity due to the sensitive nature of the topic. But the question of whether these testing disclosures will continue — including the frequency, the specificity and the implications for the season if players and staff are forced to miss games — is one that is yet to be fully addressed on a national or even conference level even though the implications this fall reach all the way from campus/public health information to sports gambling. ""I don’t believe universities will necessarily take the approach of doing a daily debrief or periodically updating their number of cases,"" said Tory Lindley, the president of the National Athletic Trainers Association and the head of the athletic training department at Northwestern. NEW LOOK:Emmert says college football in 2020 could be dramatically different MICHIGAN MAN:Is Jim Harbaugh the ""most overrated coach in the country""? IOWA UNREST:As accusations pile up, Kirk Ferentz ill-equipped to lead change And it appears they won’t have to, as disclosure of injuries and illness is an issue the NCAA and conference offices have typically stayed away from any type of standardization. But unlike the inconsistency from one school to another in announcing sprained ankles or hip flexors, COVID-19 is a new and sensitive issue. It’s also potentially a competitive issue. Though the statistics suggest the vast majority of players will be asymptomatic or have mild symptoms, we don’t really know how easy or difficult it will be to contain an outbreak on a team once practice starts and players are in close contact to one another. Administrators are concerned that the most likely way it would spread is through a position group, so if a defensive lineman tests positive, would a significant number of players at that same position be in peril of not playing in the upcoming game that weekend? And if so, is it unfair to opponents, fans and gamblers if one team announces every Wednesday that they have four positive tests and another has positive tests but doesn’t announce anything? Meanwhile, schools will have to operate in this environment while adhering to the strict laws of medical privacy but also knowing that any player or coach who isn’t on the sideline or at practice is likely going to be presumed COVID-19 positive if there’s no other reason given for their absence. And given the potential stigma around this new virus and the contact tracing implications, is that fair for the public to presume a player has COVID-19 if they actually just have the flu? ""Some of it goes back to (programs’) common practices in the past of what they disclose and when they disclose it,"" Lindley said. ""It goes back to availability and you may not know why, but you’ll know if someone is unavailable for participation and there will be variance from institution to institution of how much they share and how much is simply to protect the student-athlete for a lot of reasons. Maybe an undisclosed illness or issue or injury — or they're just listed as out and there’s no reason given."" Given all the issues athletic departments have been dealing with over the last few months, how they’ll deal with disclosure of positive tests once the season gets going has not been high on the list. On a Zoom call with reporters earlier this week, Notre Dame coach Brian Kelly suggested he hadn’t even thought about it at all and passed the issue off to his sports information director. Arkansas State athletics director Terry Mohajir, whose school was one of the first to announce that athletes had tested positive during their re-entry protocol (there were seven positives across all sports), said it’s possible they would continue announcing numbers of positive tests. He added, though, that he did not foresee many schools disclosing significant amounts of information aside from what’s required to the local health authorities and campus emergency management teams. ""I don’t ever foresee us as an institution specifically talking publicly about an individual that has tested positive for COVID,"" Mohajir said. Another athletics director, who asked not to be identified publicly because the school’s policy had not been set in stone yet, said they’re considering just issuing a weekly report on number of positive tests for the sake of consistency and not to raise suspicions that they’re trying to hide numbers whether they’re good or bad. That’s already been an issue at Alabama, for example, where the BamaInsider publication reported “as many as five” positive cases on the football team. The school later put out a statement that neither confirmed nor denied the report, citing privacy laws. As individual conferences formulate their in-season policies for testing during game weeks, at least three identified by USA TODAY Sports are discussing some type of procedure where teams would inform each other before the game if players are unavailable due to COVID-19. But there’s a clear downside to that: Once information gets exchanged, it’s almost certain to leak. It will also be rumor fuel, whether true or not. Such information could even be weaponized in recruiting. Say, hypothetically, a player is planning a visit for a Saturday game against another school that’s recruiting him. If the visiting team learns that the home team has multiple positive cases, would that staff be above suggesting to the recruit that maybe it’s not a great weekend to be on that campus?  These are among the issues and unintended consequences of COVID-19 that college athletics has yet to reckon with as the countdown to the season begins in earnest. And yet, unless the NCAA steps in and provides some guidelines around how much information schools are supposed to release around positive tests, it’s likely to devolve into the wild, wild west. Follow columnist Dan Wolken on Twitter @DanWolken."
33,33,Major League Soccer to restart with tournament similar to World Cup formatAdam Baum and Shelby Dermer ,"Jun. 10, 2020",https://www.usatoday.com/story/sports/soccer/2020/06/10/mls-restart-season-tournament-similar-world-cup-format/5332583002/,"It's not the season Major League Soccer anticipated, but the restart will offer fans an enticing alternative: a continuous schedule of matches in Florida nearly every day beginning July 8. The league announced details Wednesday morning for its MLS is Back Tournament at ESPN Wide World of Sports Complex at Walt Disney World Resort. The tournament will be played without fans.  Teams will be sequestered at the Disney complex and the league has announced a strict testing protocol.  Similar to a World Cup format, multiple games will be played daily, beginning at 9 a.m. ET, 8 p.m. and 10:30 p.m. YOUR INBOX APPROVES:Get the day's top sports headlines and analysis, delivered. Sign up now! MLS suspended its season March 12 due to the pandemic after teams had played two games. NBA also has plans in the works to resume the season at the complex in Orlando with 22 teams reporting for a condensed schedule of games beginning July 31.  In MLS, each of the 26 teams will play three group stage matches, and those results will count in the regular season standings. After 16 consecutive days of group stage matches, the top two teams from each group along with the four best third-place finishers will move on to the knockout stage. The knockout stage will include a Round-of-16, quarterfinals, semifinals and the championship match will be held Aug. 11. MLS commissioner Don Garber met with the media Wednesday via video conference call and detailed the three-month-long endeavor to plan and execute the tournament. ""We came up with this concept of a 54-match tournament similar to the very successful World Cup here in 1994 where only 24 nations competed,"" said Garber. ""Each team will have a minimum of three games in the group stage. Those results will count for the 2020 MLS season standings and that will continue when we're able to continue our season when we're back in our home markets."" Garber was asked numerous times Wednesday how the league will handle safety and medical issues regarding COVID-19.  As for the testing protocol, during an individual's first two weeks in Orlando, that person will be tested every other day. After those first 14 days, players, coaches and referees will be tested regularly, including the day before each matchday.  ""I think guys feel reasonably comfortable with it. I think some of the protocols have been well thought out,"" FC Cincinnati goalkeeper Spencer Richey said.  Self-temperature screenings and the completion of standardized screening questionnaires will be required for all individuals traveling to the ESPN Wide World of Sports Complex or providing services at the hotel and convention center where MLS league and club personnel will be staying. A positive response to the daily questionnaire or a temperature check above 100.3 degrees must be reported and the individual in question will be isolated immediately and PCR testing will be performed. With facemasks, PPE, social distancing and temperature screenings, Garber said he's confident they'll be able to manage the tournament safely. Garber was asked if there's a number of positive tests that would halt or suspend the tournament. ""No specific protocol for how many positive tests would have us take a step back and think about what happens next,"" Garber said. ""It's why we're so focused on regular testing and ensuring that we do what we need to do to keep our players safe and managing what would happen should a player test positive."" A positive test from a player would mean that player is removed from the tournament and placed in quarantine, then contact tracing would be done for those that were in contact within 10 feet of that person. A draw for the tournament will be held Thursday to determine the six groups. For the remainder of the season, Nashville SC will be moved to the Eastern Conference. The Eastern Conference will have three groups, one consisting of six teams and two consisting of four teams each. The Western Conference will have three groups, each consisting of four teams. As the host club, Orlando City SC will be given the top seed in Group A, which will be the six-team group, and will play in the first match on July 8.  The five remaining seeds will consist of the four semifinalists from the 2019 MLS Cup Playoffs – Atlanta United, Los Angeles Football Club, Seattle Sounders FC, Toronto FC – and Real Salt Lake (the team with the next highest points total in the Western Conference from the 2019 season).  The seeded teams will be drawn into their respective groups first and then the remaining 20 clubs will be drawn and distributed across the conference-based groups. After the MLS is Back Tournament, MLS plans to continue its regular season with a revised schedule in home markets, followed by the Audi MLS Cup Playoffs and the 25th MLS Cup. The schedule will be developed at a later date. "
34,34,2 more Oklahoma St football players positive for COVID-19,"Jun. 3, 2020",https://www.usatoday.com/story/sports/ncaaf/2020/06/03/2-more-oklahoma-st-football-players-positive-for-covid-19/111904166/,"STILLWATER, Okla. (AP) — Two more Oklahoma State football players have tested positive for COVID-19 since returning to campus for voluntary workouts, bringing the total to three. Senior associate athletic director Kevin Klintworth wrote on his Twitter account Wednesday that of the 150 staff, administrators and athletes tested, three athletes had asymptomatic positives. Linebacker Amen Ogbongbemiga announced Tuesday he tested positive after he attended a protest in Tulsa, Oklahoma. The other two players were not identified. “Positives were expected and the plan for that scenario has been activated,"" Klintworth wrote. “We will be as forthcoming as possible on the covid issues."" OSU spokesman Gavin Lang said there would be no additional comment. Marshall University in West Virginia announced Monday two of its football players and one staff member tested positive. Iowa State said Wednesday a student worker in its athletic department tested positive and that four athletes were showing symptoms and awaiting test results. The three positives at Oklahoma State come two months after Cowboys coach Mike Gundy was criticized for being insensitive in comments about the nation's response to the pandemic. He referenced the financial impact of football while suggesting players should return to campus as early as May 1. “They’re in good shape, they’re all 18, 19, 20, 21, 22 years old, they’re healthy,"" Gundy said April 7. “A lot of them can fight it off with their natural body, the antibodies and build that they have. There’s some people that are asymptomatic. “If that’s true, then yeah, we sequester them. And people say, ‘That’s crazy.’ No, it’s not crazy, because we need to continue to budget and run money through the state of Oklahoma.” Gundy apologized four days later, saying he understood his comments offended some people and that his first priority is the well-being of student-athletes. The Big 12 is allowing schools to bring football players to campus for voluntary workouts beginning June 15. Oklahoma State this week announced a phased approach for the return of its players. Under the plan, players who test positive are quarantined in separate housing and treated by medical staff. Contact tracing is done, and all that have been in contact will be instructed to quarantine and have symptoms monitored for a period determined by health and medical officials. After the determined quarantine time, if the traced contact group is not showing symptoms, the affected player will be retested for COVID-19 prior to resuming activities. Upon receiving a negative test, they will await specific instructions from the team physician and/or the athletic training staff regarding a return to activities. For most people, the coronavirus causes mild or moderate symptoms that clear up within weeks. But for others, especially older adults and people with existing health problems, the highly contagious virus can cause severe symptoms and be fatal. The vast majority of people recover. ___ More AP college football: https://apnews.com/Collegefootball and https://twitter.com/AP_Top25"
35,35,"Ohio governor sets reopening date for amusement parks, casinos after lawsuitJessie Balmert, Jessie Balmert and Hannah K. Sparling ","Jun. 6, 2020",https://www.usatoday.com/story/travel/2020/06/05/coronavirus-ohio-governor-let-theme-parks-casinos-reopen/3160436001/,"COLUMBUS – Ohio's amusement parks and casinos, including Kings Island, Coney Island and Jack Casino, can reopen as soon as June 19, Ohio Gov. Mike DeWine said Friday. The news comes after other theme parks and casinos across the country have begun to reopen amid the ongoing coronavirus pandemic. Universal Orlando became the first of Orlando's major theme park resorts to reopen, allowing annual pass-holders to return to its three parks Wednesday and Thursday. Walt Disney World plans to welcome back visitors to its parks in July, and Las Vegas casinos reopened Thursday. Kings Island and Cedar Point, both owned by Cedar Fair Entertainment Company, filed lawsuits against DeWine's administration on Thursday, saying orders were imposing criminal penalties on their business. But DeWine insists that the lawsuits – and a move from Ohio lawmakers to speed up opening dates for amusement parks and water parks – played no role in his decision. “They should have saved their money (spent) on lawyers,"" DeWine said. ""I told them a week ago that we would have an answer today, and that’s what we did."" Kings Island hasn't yet set a date to reopen.  ""The reopening of our parks is crucial to the economic viability of Erie County and Warren County,"" Cedar Fair Entertainment Company CEO Richard Zimmerman said in a statement. ""We look forward to getting back to business and hope that other states will follow Ohio’s lead in reopening parks around the country,"" Theme parks might look much different when they ultimately open. Temperature checks could be required of guests. More frequent cleaning and social distancing will be imposed where possible. Kings Island will announce more details closer to opening day. In addition to amusement parks and water parks, casinos and racinos can reopen as soon as June 19. But there will be restrictions: poker, coat check, valet services, concerts and banquets won't be available yet.  Las Vegas reopening starts tonight despite George Floyd protests. Here's what's on tap The maximum capacity will be limited to no more than 50% of fire code, most employees will wear face coverings and special hours will be set aside for at-risk populations, such as older adults. DeWine knows that some Ohioans, including several fellow Republicans, would rather he open all businesses in the state without any restrictions.  “To do that in the midst of this pandemic makes absolutely no sense,"" DeWine said. ""It would not be the right thing to do. Frankly, to do that would be an abandonment of the duty I have as your governor.” 'We felt super safe': Universal Orlando reopens; here's what it's like with coronavirus precautions Meanwhile, Ohio isn't testing as many residents as it planned to, and some lawmakers have proposed a way to limit contact tracing, which allows local health officials to track who has been infected.  Requiring written consent before conducting contact tracing would be ""a mistake,"" DeWine said. ""This is a solution without a problem."" As of Friday afternoon, 37,758 Ohioans had been infected with COVID-19 at one point, according to the Ohio Department of Health. Of those, 2,355 people had died and 6,385 had been hospitalized. In Ohio, 443,533 people had been tested for the respiratory virus, an increase of more than 8,900 reported from the previous day.  Contributing: Dawn Gilbertson, USA TODAY, Mike Schneider, Associated Press"
36,36,'We were founded as a sign of hope': Salzburg Festival will continue on a smaller scale,"Jun. 9, 2020",https://www.usatoday.com/story/entertainment/music/2020/06/09/coronavirus-salzburg-festival-continue-smaller-scale/5325633002/,"The Salzburg Festival will be one of classical music’s few offerings in the summer of the coronavirus pandemic, staging a reduced 100th anniversary celebration with capacities limited to about 50%. Europe’s top festival announced Tuesday it will present 90 performances, down from 212 originally intended. Venues will be cut from 16 to seven and intermissions eliminated to reduce audience interaction. The only operas will be a Mozart’s “Cosi fan Tutte” in the Grosses Festspielhaus, limited to about 1,000 of its 2,300 seats, and Richard Strauss’ “Elektra” in the Felsenreitschule, which will hold roughly 700. Originally set to run from July 18 to Aug. 30, the festival will now start Aug. 1. Nearly every other major summer festival in Europe and the U.S. has been canceled. “It would have been much easier not to play, but we were founded as a sign of hope so we want to play,” festival president Helga Rabl-Stadler said in a telephone interview. The festival had sold 180,000 of 230,000 tickets to people in 80 nations but now is limiting seats to about 70,000. Only those who already bought tickets can still attend and there will be a limit of two per person. Names of purchasers will be printed on tickets and records kept to enable contact tracing. More:Cannes reveals lineup for film festival canceled by the coronavirus pandemic There are two active cases of COVID-19 in the Salzburg province, according to the Austrian government’s dashboard. “We do not know how many people will come, how many people will say, `Thank you. We love you but we don’t come here because it’s impossible, because of health reasons or I bake bread’ or something,″ Rabl-Stadler said. “So it’s like walking in a fog.” Every other seat will be left open. People in the audience must wear masks when entering, but will be allowed to remove them during the performance. Artists and backstage staff will be tested regularly. Backstage staff will be pared down and wear masks. Christof Loy’s staging of “Cosi fan Tutte” will have cuts. “It will be a super-modest set, super-modest costumes, a very-reduced rehearsal time,” artistic director Markus Hinterhäuser said. “A different `Cosi fan Tutte’ in corona times, if I might say. This is my little surprise.” There will be 14 performances of Hugo von Hofmannsthal’s “Jedermann (Everyman)” on the Domplatz in front of the cathedral, including one on Aug. 22 to mark the 100th anniversary of the day that play inaugurated the festival. Capacity in the square will be limited to 1,250 rather than 2,300. Rabl-Stadler said the festival will be short about 15 million euros ($17 million) in revenue, 8 million euros due to lost performances and the rest because of lower capacity. The festival usually generates 75% of revenue from tickets, sponsors and donations, Mozart’s “Don Giovanni” and “Die Zauberflöte (The Magic Flute),” Puccini’s “Tosca,” Donizetti’s “Don Pasquale” and Luigi Nono’s “Intolleranza” have been postponed to 2021 and Mussorgsky’s “Boris Godunov” to 2022. “We celebrate our 100th anniversary for two years,” she said. More:'Welcome to being black in America': Gayle King, more celebs express fear about racism and their kids"
